{
  "reflexionsimpuls": "Deutschland wollte \u201eseinen Platz an der Sonne\u201c. Wer musste dafür in den Schatten treten?",
  "hefteintrag_verweis": "Übertrage den Hefteintrag in dein Heft. Achte besonders auf die zwei Folgestränge: Folgen für Europa und Folgen für Afrika.",
  "zusammenfassung": "In dieser Mappe hast du gesehen, wie Kaiser Wilhelm II. nach 1890 eine aggressive „Weltpolitik“ verfolgte und Deutschland in den beiden Marokkokrisen 1905 und 1911 zweimal an den Rand eines Krieges mit Frankreich führte. Der Trotha-Befehl und das Foto der überlebenden Herero haben gezeigt, was dieser Wettlauf für die Kolonisierten bedeutete: Landraub, Zwangsarbeit und — nach dem Aufstand 1904 — einen Vernichtungskrieg. Aus dem Streit um Kolonien wurde wachsendes Misstrauen zwischen den Großmächten.",
  "ueberleitung": "Damit schließt die Sequenz zum deutschen Nationalismus und Kolonialismus: Vom Traum der nationalen Einheit über Bismarcks Bündnissystem bis zum Wettlauf um die Welt hat sich ein Bogen gespannt. Wilhelms „Weltpolitik“ hinterließ Gewalt in den Kolonien und Misstrauen in Europa — beides wird im Folge-Game zum Ersten Weltkrieg wieder auftauchen.",
  "zitat": {
    "text": "Wir wollen niemand in den Schatten stellen, aber wir verlangen auch unseren Platz an der Sonne.",
    "urheber": "Bernhard von Bülow",
    "kontext": "Rede vor dem Reichstag, 6. Dezember 1897 — Symbol des deutschen Weltmachtanspruchs"
  }
}
