{
  "reflexionsimpuls": "Die Berliner Konferenz entschied ueber das Schicksal eines ganzen Kontinents. Was waere anders gelaufen, wenn Vertreter Afrikas am Tisch gesessen haetten?",
  "hefteintrag_verweis": "Uebertrage den Hefteintrag in dein Heft. Achte besonders auf die drei Motive des Kolonialerwerbs und die Rolle der Berliner Konferenz.",
  "zusammenfassung": "Das Deutsche Reich wollte Kolonien — aus Wirtschaftsinteresse und nationalem Prestige. Auf der Berliner Konferenz 1884 teilten Europaeer Afrika auf — ohne einen Afrikaner zu fragen.",
  "ueberleitung": "Am gruenen Tisch in Berlin hatten Diplomaten Grenzen gezogen. Doch was bedeutete das fuer die Menschen, die in den neuen 'Schutzgebieten' lebten? In Deutsch-Suedwestafrika wurde die Antwort besonders brutal.",
  "zitat": {
    "text": "Wir wollen niemand in den Schatten stellen, aber wir verlangen auch unseren Platz an der Sonne.",
    "urheber": "Bernhard von Buelow",
    "kontext": "Rede vor dem Reichstag, 6. Dezember 1897"
  }
}
