{
  "reflexionsimpuls": "Was hat sich an deinem Bild vom Ersten Weltkrieg verändert?",
  "hefteintrag_verweis": "Übertrage das Tafelbild in dein Heft. Zeichne, wie Stellungskrieg, Giftgas und Ausblutungsschlacht gemeinsam zur Hoffnungslosigkeit führen.",
  "zusammenfassung": "Der Stellungskrieg zwang Millionen Soldaten in Schützengräben. Giftgas, Ausblutungsschlachten bei Verdun und der Somme und die Materialschlacht machten den Krieg zu einer Hölle ohne Ausweg. Am Ende blieb den Soldaten nur Hoffnungslosigkeit.",
  "ueberleitung": "Die Soldaten im Schützengraben erleben jahrelanges Leiden und Hoffnungslosigkeit. Doch was passiert gleichzeitig zuhause — wo Frauen in Fabriken arbeiten und Kinder hungern?",
  "zitat": {
    "text": "Wir fielen wie Kaninchen im Gewehrfeuer.",
    "urheber": "Britischer Infanterist, Schlacht an der Somme 1916 [sinngemäß]",
    "kontext": "Beschreibung des ersten Angriffstages am 1. Juli 1916, an dem 57.000 britische Soldaten fielen."
  }
}
